id,details
GO-2020-0016,"An attacker can construct a series of bytes such that calling Reader.Read on the bytes could cause an infinite loop. If parsing user supplied input, this may be used as a denial of service vector."
GO-2022-1008,"SGID programs executed in a container can access files that have negative group permissions for the user's primary group.

Consider a file which is owned by user u1 and group g1, permits user and other read access, and does NOT permit group read access. This file is readable by u1 and all other users except for ones in group g1.

A program with the set-group-ID (SGID) bit set assumes the primary group of the program's group when it executes.

A user with the primary group g1 who executes an SGID program owned by group g2 should not be able to access the file described above. While the program executes with the primary group g2, the group g1 should remain in its supplementary groups, blocking access to the file.

Buildah does not correctly add g1 to the supplementary groups in this scenario, permitting unauthorized access."
GO-2023-2116,"A cross-site request forgery vulnerability can allow an attacker to obtain tokens and forge malicious requests on behalf of a user. This can lead to unauthorized actions being taken on the user's behalf, potentially compromising the security and integrity of the application.

The vulnerability is caused by improper validation and enforcement of CSRF tokens within the application. The CSRF token is validated against tokens in storage but was is not tied to the original requestor that generated it, allowing for token reuse."
GO-2023-2115,"A cross-site request forgery vulnerability in this package can allow an attacker to inject arbitrary values and forge malicious requests on behalf of a user. The attacker may inject arbitrary values without any authentication, or perform various malicious actions on behalf of an authenticated user, potentially compromising the security and integrity of the application.

The vulnerability is caused by improper validation and enforcement of CSRF tokens within the application. For 'safe' methods, the token is extracted from the cookie and saved to storage without further validation or sanitization. In addition, the CSRF token is validated against tokens in storage but not associated with a session, nor by using a Double Submit Cookie Method, allowing for token reuse."
GO-2022-0253,"The HTTPFetcher.GetXML function reads a response of unlimited size into memory, permitting resource exhaustion."
GO-2020-0019,"An attacker can craft malicious WebSocket frames that cause an integer overflow in a variable which tracks the number of bytes remaining. This may cause the server or client to get stuck attempting to read frames in a loop, which can be used as a denial of service vector."
GO-2022-1002,ParseVector can panic when provided with invalid input.
GO-2023-1597,Improper sanitization and filtering of HTML entities in user input can lead to cross-site scripting (XSS) attacks where arbitrary JavaScript code is executed in the browser.
GO-2022-0534,"Validation of Gitlab requests can leak secrets.

The package github.com/runatlantis/atlantis/server/controllers/events uses a non-constant time comparison for secrets while validating a Gitlab request. This allows for a timing attack where an attacker can recover a secret and then forge the request."
GO-2021-0079,"A malformed query can cause an out-of-bounds panic due to improper validation of arguments. If processing queries from untrusted parties, this may be used as a vector for denial of service attacks."
GO-2022-0701,"Crafted object type names can cause directory traversal in Kubernetes.

Object names are not validated before being passed to etcd. This allows attackers to write arbitrary files via a crafted object name, hence causing directory traversal vulnerability in Kubernetes, as used in Red Hat OpenShift Enterprise 3.0."
GO-2021-0085,"AppArmor restrictions may be bypassed due to improper validation of mount targets, allowing a malicious image to mount volumes over e.g. /proc."
GO-2021-0075,"Due to improper argument validation in RPC messages, a maliciously crafted message can cause a panic, leading to denial of service."
GO-2021-0265,A maliciously crafted path can cause Get and other query functions to consume excessive amounts of CPU and time.
GO-2021-0107,"Web Sockets do not execute any AuthenticateMethod methods which may be set, leading to a nil pointer dereference if the returned UserData pointer is assumed to be non-nil, or authentication bypass.

This issue only affects WebSockets with an AuthenticateMethod hook. Request handlers that do not explicitly use WebSockets are not vulnerable."
GO-2021-0100,"Due to a goroutine deadlock, using github.com/containers/storage/pkg/archive.DecompressStream on a xz archive returns a reader which will hang indefinitely when Close is called. An attacker can use this to cause denial of service if they are able to cause the caller to attempt to decompress an archive they control."
GO-2023-2052,The Ctx.IsFromLocal function can incorrectly report a request as being sent from localhost when the request contains an X-Forwarded-For header containing a localhost IP address.
GO-2022-0463,"Routes in the beego HTTP router can match unintended patterns. This overly-broad matching may permit an attacker to bypass access controls.

For example, the pattern ""/a/b/:name"" can match the URL ""/a.xml/b/"". This may bypass access control applied to the prefix ""/a/""."
GO-2022-0252,OctoRPKI crashes when a repository returns an ROA with a IP address that contains too many bits.
GO-2020-0021,"Due to improper sanitization of user input, a number of methods are vulnerable to SQL injection if used with user input that has not been sanitized by the caller."
GO-2020-0028,"Due to a nil pointer dereference, parsing a malformed zone file containing TA records may cause a panic. If parsing user supplied input, this may be used as a denial of service vector."
GO-2020-0035,"Due to improper path sanitization, archives containing relative file paths can cause files to be written (or overwritten) outside of the target directory."
GO-2022-0370,"Websocket client connections are vulnerable to man-in-the-middle attacks via DNS spoofing.

When looking up a WSS endpoint using a DNS TXT record, the server TLS certificate is incorrectly validated using the name of the server returned by the TXT record request, not the name of the the server being connected to. This permits any attacker that can spoof a DNS record to redirect the user to a server of their choosing.

Providing a *tls.Config with a ServerName field set to the correct destination hostname will avoid this issue."
GO-2020-0017,"If a JWT contains an audience claim with an array of strings, rather than a single string, and MapClaims.VerifyAudience is called with req set to false, then audience verification will be bypassed, allowing an invalid set of audiences to be provided."
GO-2022-0400,A race condition can cause incorrect HTTP request routing.
GO-2022-1184,"The manipulation of the argument path to docconv.{ConvertPDF,PDFHasImage} leads to os command injection."
GO-2022-0643,"A local attacker can cause a panic if they are able to send arbitrary traffic to a monitored port, due to an out of bounds read."
GO-2022-1165,"Applications that use the repo package in the Helm SDK to parse an index file can suffer a Denial of Service when that input causes a panic that cannot be recovered from.

The repo package contains a handler that processes the index file of a repository. For example, the Helm client adds references to chart repositories where charts are managed. The repo package parses the index file of the repository and loads it into memory. Some index files can cause array data structures to be created causing a memory violation.

The Helm Client will panic with an index file that causes a memory violation panic. Helm is not a long running service so the panic will not affect future uses of the Helm client."
GO-2022-1052,"Mishandling of timestamps during consensus process can cause a denial of service.

While reaching consensus, different tendermint nodes can observe a different timestamp for a consensus evidence. This mismatch can cause the evidence to be invalid, upon which the node producing the evidence will be asked to generate a new evidence. This new evidence will be the same, which means it will again be rejected by other nodes involved in the consensus. This loop will continue until the peer nodes decide to disconnect from the node producing the evidence."
GO-2022-0346,A maliciously crafted RPM file can cause the Scanner.Scan function to write files with arbitrary contents to arbitrary locations on the local filestem.
GO-2020-0050,"Due to the behavior of encoding/xml, a crafted XML document may cause XML Digital Signature validation to be entirely bypassed, causing an unsigned document to appear signed."
GO-2022-1166,"Certain JSON schema validation files can cause a Helm Client to panic, leading to a possible denial of service.

The chartutil package contains a parser that loads a JSON Schema validation file. For example, the Helm client when rendering a chart will validate its values with the schema file. The chartutil package parses the schema file and loads it into memory, but some schema files can cause array data structures to be created causing a memory violation.

The Helm Client will panic with a schema file that causes a memory violation panic. Helm is not a long running service so the panic will not affect future uses of the Helm client."
GO-2022-0587,"An issue in ast.Parser in Open Policy Agent causes the application to incorrectly interpret expressions, allowing a Denial of Service (DoS) via triggering out-of-range memory access."
GO-2021-0064,Authorization tokens may be inappropriately logged if the verbosity level is set to a debug level.
GO-2023-1874,"Due to the misuse of log.Fatalf, Coraza may crash after receiving crafted requests from attackers."
GO-2021-0076,A malicious JSON patch can cause a panic due to an out-of-bounds write attempt. This can be used as a denial of service vector if exposed to arbitrary user input.
GO-2020-0005,"Malformed WALs can be constructed such that WAL.ReadAll can cause attempted out of bounds reads, or creation of arbitrarily sized slices, which may be used as a DoS vector."
GO-2020-0037,"Due to support of Gzip compression in request bodies, as well as a lack of limiting response body sizes, a malicious server can cause a client to consume a significant amount of system resources, which may be used as a denial of service vector."
GO-2022-1129,Authentication bypass is possible when processing SAML responses containing multiple Assertion elements.
GO-2022-0379,"Systems that rely on digest equivalence for image attestations may be vulnerable to type confusion.

A maliciously crafted OCI Container Image can cause registry clients to parse the same image in two different ways without modifying the image's digest, invalidating the common pattern of relying on container image digests for equivalence.

This problem has been addressed in newer versions by improving validation in manifest unmarshalling."
GO-2021-0066,Attempting to read a malformed .dockercfg may cause secrets to be inappropriately logged.
GO-2022-0945,"The go-jose library suffers from multiple signatures exploitation. When validating a signed message, the API did not indicate which signature was valid, which creates the potential for confusion."
GO-2020-0009,"On 32-bit platforms an attacker can manipulate a ciphertext encrypted with AES-CBC with HMAC such that they can control how large the input buffer is when computing the HMAC authentication tag. This can can allow a manipulated ciphertext to be verified as authentic, opening the door for padding oracle attacks."
GO-2020-0010,When using ECDH-ES an attacker can mount an invalid curve attack during decryption as the supplied public key is not checked to be on the same curve as the receivers private key.
GO-2023-1664,Denial of service via deflate compression bomb in github.com/crewjam/saml
GO-2022-0572,An issue was discovered in the route lookup process in beego which attackers to bypass access control.
GO-2023-2119,"A a third party may derive a valid proof from a valid initial tuple {proof, public_inputs}, corresponding to the same public inputs as the initial proof. This vulnerability is due to randomness being generated using a small part of the scratch memory describing the state, allowing for degrees of freedom in the transcript. Note that the impact is limited to the PlonK verifier smart contract."
GO-2022-0762,An XSS injection was possible because the sanitization of the Cyrillic character i bypass a protection mechanism against user-inputted HTML elements such as the <script> tag.
GO-2022-0355,"The fasthttp.FS request handler is vulnerable to directory traversal attacks on Windows systems, and can serve files from outside the provided root directory.

URL path normalization does not handle Windows path separators (backslashes), permitting an attacker to construct requests with relative paths."
GO-2022-0957,A maliciously crafted JSON input can cause a denial of service attack.
GO-2022-0274,An attacker with partial control over the bind mount sources of a new container can bypass namespace restrictions.
GO-2021-0106,"Due to improper path sanitization, archives containing relative file paths can cause files to be written (or overwritten) outside of the target directory."
GO-2022-0574,An issue in the AST parser of Open Policy Agent makes it possible for attackers to cause a Denial of Service attack from a crafted input.
GO-2020-0008,DNS message transaction IDs are generated using math/rand which makes them relatively predictable. This reduces the complexity of response spoofing attacks against DNS clients.
GO-2022-1045,The Singularity Image Format (SIF) reference implementation does not verify that the hash algorithm(s) used are cryptographically secure when verifying digital signatures.
GO-2022-1130,"If an attacker has access to a Prometheus web.yml file and users' bcrypted passwords, it would be possible to bypass security via the built-in authentication cache."
GO-2023-1717,Users can create a keyspace containing `/`. Future attempts to view keyspaces from some tools (including VTAdmin and `vtctldclient GetKeyspaces`) receive an error.
GO-2023-1574,"Supplementary groups are not set up properly inside a container. If an attacker has direct access to a container and manipulates their supplementary group access, they may be able to use supplementary group access to bypass primary group restrictions in some cases and potentially escalate privileges in the container. Uses of the containerd client library may also have improperly setup supplementary groups."
GO-2021-0103,"Due to improper bounds checking, certain mathematical operations can cause a panic via an out of bounds read. If this package is used to process untrusted user inputs, this may be used as a vector for a denial of service attack."
GO-2020-0041,"Due to improper path sanitization, archives containing relative file paths can cause files to be written (or overwritten) outside of the target directory."
GO-2021-0228,"The ExtractTo function doesn't securely escape file paths in zip archives which include leading or non-leading "".."". This allows an attacker to add or replace files system-wide."
GO-2022-0246,"The ROAEntry.Validate function fails to perform bounds checks on the MaxLength field, allowing invalid values to pass validation."
GO-2021-0065,Authorization tokens may be inappropriately logged if the verbosity level is set to a debug level.
GO-2023-2077,Authentication bypass in github.com/sagernet/sing
GO-2020-0020,"Usage of the CORS handler may apply improper CORS headers, allowing the requester to explicitly control the value of the Access-Control-Allow-Origin header, which bypasses the expected behavior of the Same Origin Policy."
GO-2021-0094,Protections against directory traversal during archive extraction can be bypassed by chaining multiple symbolic links within the archive. This allows a malicious attacker to cause files to be created outside of the target directory. Additionally if the attacker is able to read extracted files they may create symbolic links to arbitrary files on the system which the unpacker has permissions to read.
GO-2023-1494,There is a potential for SQL injection through manipulation of the sqlStatement argument.
GO-2021-0109,"Due to improper error handling, an error with the underlying token storage may cause a user to believe a token has been successfully revoked when it is in fact still valid. An attackers ability to exploit this relies on an ability to trigger errors in the underlying storage."
GO-2021-0112,"Due to improper input sanitization when marshalling Go objects into BSON, a maliciously constructed Go structure could allow an attacker to inject additional fields into a MongoDB document. Users are affected if they use this package to handle untrusted user input."
GO-2022-0706,Sensitive HTTP headers may not be properly sanitized before being sent to the APM server if the program panics.
GO-2021-0051,"Due to improper sanitization of user input on Windows, the static file handler allows for directory traversal, allowing an attacker to read files outside of the target directory that the server has permission to read."
GO-2022-0422,The dag-pb codec can panic when decoding invalid blocks.
GO-2020-0048,"LoadURL does not check the Content-Type of loaded resources, which can cause a panic due to nil pointer deference if the loaded resource is not XML. If user supplied URLs are loaded, this may be used as a denial of service vector."
GO-2020-0039,"Due to improper request sanitization, a specifically crafted URL can cause the static file handler to redirect to an attacker chosen URL, allowing for open redirect attacks."
GO-2023-2048,Certain rootfs and path combinations result in generated paths that are outside of the provided rootfs on Windows.
GO-2022-0251,OctoRPKI crashes when a repository returns an invalid ROA that is only an encoded NUL character (\0).
GO-2023-1515,"A denial of service (DoS) vulnerability exists in the Wrangler Git package. Specially crafted Git credentials can result in a denial of service (DoS) attack on an application that uses Wrangler due to the exhaustion of the available memory and CPU resources.

This is caused by a lack of input validation of Git credentials before they are used, which may lead to a denial of service in some cases. This issue can be triggered when accessing both private and public Git repositories.

A workaround is to sanitize input passed to the Git package to remove potential unsafe and ambiguous characters. Otherwise, the best course of action is to update to a patched Wrangler version."
GO-2022-0586,"Malicious HTTP responses can cause a number of misbehaviors, including overwriting local files, resource exhaustion, and panics.

* Protocol switching, endless redirect, and configuration bypass are possible through abuse of custom HTTP response header processing.

* Arbitrary host access is possible through go-getter path traversal, symlink processing, and command injection flaws.

* Asymmetric resource exhaustion can occur when go-getter processes malicious HTTP responses.

* A panic can be triggered when go-getter processed password-protected ZIP files."
GO-2020-0027,"After dropping and then elevating process privileges euid, guid, and groups are not properly restored to their original values, allowing an unprivileged user to gain membership in the root group."
GO-2021-0101,"Due to an improper bounds check, parsing maliciously crafted messages can cause panics. If this package is used to parse untrusted input, this may be used as a vector for a denial of service attack."
GO-2020-0006,"An attacker may prevent TCP connections to a Server by opening a connection and leaving it idle, until the connection is closed by the server no other connections will be accepted."
GO-2021-0070,"GetExecUser in the github.com/opencontainers/runc/libcontainer/user package will improperly interpret numeric UIDs as usernames. If the method is used without verifying that usernames are formatted as expected, it may allow a user to gain unexpected privileges."
GO-2023-2074,Parser out-of-bounds read vulnerability caused by a malformed markdown input
GO-2021-0237,Attackers may be able to craft phishing links and other open redirects by exploiting PowerMux's trailing slash redirection feature. This may lead to users being redirected to untrusted sites after following an attacker crafted link.
GO-2022-0978,"Open Policy Agent (OPA) is an open source, general-purpose policy engine. The Rego compiler provides a (deprecated) `WithUnsafeBuiltins` function, which allows users to provide a set of built-in functions that should be deemed unsafe and rejected by the compiler if encountered in the policy compilation stage.

A bypass of this protection is possible when using the `with` keyword to mock a built-in function that isn't taken into account by `WithUnsafeBuiltins`."
GO-2023-1713,An attacker can craft a remote request to upload a file to `/group1/upload` that uses path traversal to instead write the file contents to an attacker controlled path on the server.
GO-2023-2133,"Without any authorization rules in the nats-server, users can connect without authentication.

Before nats-server 2.2.0, all authentication and authorization rules for a nats-server lived in an ""authorization"" block, defining users. With nats-server 2.2.0 all users live inside accounts. When using the authorization block, whose syntax predates this, those users will be placed into the implicit global account, ""$G"". Users inside accounts go into the newer ""accounts"" block.

If an ""accounts"" block is defined, in simple deployment scenarios this is often used only to enable client access to the system account. When the only account added is the system account ""$SYS"", the nats-server would create an implicit user in ""$G"" and set it as the `no_auth_user` account, enabling the same ""without authentication"" logic as without any rules.

This preserved the ability to connect simply, and then add one authenticated login for system access.

But with an ""authorization"" block, this is wrong. Users exist in the global account, with login rules. And in simple testing, they might still connect fine without administrators seeing that authentication has been disabled.

In the fixed versions, using an ""authorization"" block will inhibit the implicit creation of a ""$G"" user and setting it as the `no_auth_user` target. In unfixed versions, just creating a second account, with no users, will also inhibit this behavior."
GO-2022-0603,An issue in the Unmarshal function can cause a program to panic when attempting to deserialize invalid input.
GO-2023-1573,"When importing an OCI image, there was no limit on the number of bytes read from the io.Reader passed into ImportIndex. A large number of bytes could be read from this and could cause a denial of service."
GO-2023-1872,OpenFGA is vulnerable to a denial of service attack when certain Check and ListObjects calls are executed against authorization models that contain circular relationship definitions.
GO-2023-1534,"Unmarshalling a Hello Verify request can panic, which could allow a denial of service."
GO-2020-0042,"Due to improper path sanitization, RPMs containing relative file paths can cause files to be written (or overwritten) outside of the target directory."
GO-2023-1859,AES-CBC decryption is vulnerable to a timing attack which may permit an attacker to recover the plaintext of JWE data.
GO-2022-0646,"The Go AWS S3 Crypto SDK contains vulnerabilities that can permit an attacker with write access to a bucket to decrypt files in that bucket.

Files encrypted by the V1 EncryptionClient using either the AES-CBC content cipher or the KMS key wrap algorithm are vulnerable. Users should migrate to the V1 EncryptionClientV2 API, which will not create vulnerable files. Old files will remain vulnerable until re-encrypted with the new client."
GO-2021-0110,"Uniqueness of JWT IDs (jti) are not checked, allowing the JWT to be replayed."
GO-2022-0460,An attacker can send packets that send the DTLS server or client into an infinite loop.
GO-2022-0438,"The getter package can write SSH credentials to its logfile, exposing credentials to local users able to read the logfile."
GO-2022-1201,"Client secret checks are vulnerable to timing attacks, which could permit an attacker to determine client secrets."
GO-2023-2101,Incorrect exponentiation results in github.com/consensys/gnark-crypto
GO-2023-1611,fsutil.Unzip is vulnerable to path traversal attacks due to improper validation of paths.
GO-2022-0244,"Random data used to create UUIDs can contain zeros, resulting in predictable UUIDs and possible collisions."
GO-2021-0105,"Due to an incorrect state calculation, a specific set of transactions could cause a consensus disagreement, causing users of this package to reject a canonical chain."
GO-2022-0248,"Manifest path extraction is vulnerable to directory traversal attacks.

The ExtractPathManifest function permits file paths containing relative directory components (""..""), permitting files to reference arbitrary locations on the filesystem."
GO-2023-1559,"Trying to read malformed HAMT sharded directories can cause panics and virtual memory leaks. If you are reading untrusted user input, an attacker can then trigger a panic.

This is caused by a bogus fanout parameter in the HAMT directory nodes.

There are no known workarounds (users are advised to upgrade)."
