id,details
GO-2023-1623,"An out of memory panic vulnerability exists in the crossplane-runtime libraries.

Applications that use the Paved type's SetValue method with user-provided input that is not properly validated might use excessive amounts of memory and cause an out of memory panic.

In the fieldpath package, the Paved.SetValue method sets a value on the Paved object according to the provided path, without any validation. This allows setting values in slices at any provided index, which grows the target array up to the requested index. The index is currently capped at max uint32 (4294967295), a large value. If callers do not validate paths' indexes on their own, this could allow users to consume arbitrary amounts of memory.

Applications that do not use the Paved type's SetValue method are not affected.

Users unable to upgrade can work around this issue by parsing and validating the path before passing it to the SetValue method of the Paved type, constraining the index size as deemed appropriate."
GO-2021-0063,"Due to a nil pointer dereference, a maliciously crafted RPC message can cause a panic. If handling RPC messages from untrusted clients, this may be used as a denial of service vector."
GO-2020-0022,"LZ4 bindings use a deprecated C API that is vulnerable to memory corruption, which could lead to arbitrary code execution if called with untrusted user input."
GO-2023-1765,"When sampling randomness for a shared secret, the implementation of Kyber and FrodoKEM, did not check whether crypto/rand.Read() returns an error. In rare deployment cases (error thrown by the Read() function), this could lead to a predictable shared secret.

The tkn20 and blindrsa components did not check whether enough randomness was returned from the user provided randomness source. Typically the user provides crypto/rand.Reader, which in the vast majority of cases will always return the right number random bytes. In the cases where it does not, or the user provides a source that does not, the blinding for blindrsa is weak and integrity of the plaintext is not ensured in tkn20."
GO-2023-1566,A malicious actor can introduce links starting with a `javascript:` scheme due to insufficient checks on external resources. This can be used as a part of Cross-site Scripting (XSS) attack.
GO-2020-0038,"Due to improper verification of packets, unencrypted packets containing application data are accepted after the initial handshake. This allows an attacker to inject arbitrary data which the client/server believes was encrypted, despite not knowing the session key."
GO-2021-0087,"A race while mounting volumes allows a possible symlink-exchange attack, allowing a user whom can start multiple containers with custom volume mount configurations to escape the container."
GO-2021-0058,"Due to the behavior of encoding/xml, a crafted XML document may cause XML Digital Signature validation to be entirely bypassed, causing an unsigned document to appear signed."
GO-2021-0098,Due to the standard library behavior of exec.LookPath on Windows a number of methods may result in arbitrary code execution when cloning or operating on untrusted Git repositories.
GO-2022-0417,"Containers are created with non-empty inheritable Linux process capabilities, permitting programs with inheritable file capabilities to elevate those capabilities to the permitted set during execve(2).

This bug does not affect the container security sandbox, as the inheritable set never contains more capabilities than are included in the container's bounding set."
GO-2023-1602,"A bug in SAML authentication library can result in Denial of Service attacks.

Attackers can craft a `deflate`-compressed request which will consume significantly more memory during processing than the size of the original request. This may eventually lead to memory exhaustion and the process being killed."
GO-2022-0980,"The text of errors returned by Template.Execute can contain Vault secrets, potentially revealing these secrets in logs or error reports."
GO-2021-0090,"Proposed commits may contain signatures for blocks not contained within the commit. Instead of skipping these signatures, they cause failure during verification. A malicious proposer can use this to force consensus failures."
GO-2020-0025,"Due to improper path sanitization, archives containing relative file paths can cause files to be written (or overwritten) outside of the target directory."
GO-2021-0072,"Various storage methods do not impose limits on how much content is accepted from user requests, allowing a malicious user to force the caller to allocate an arbitrary amount of memory."
GO-2020-0023,"Token validation methods are susceptible to a timing side-channel during HMAC comparison. With a large enough number of requests over a low latency connection, an attacker may use this to determine the expected HMAC."
GO-2022-0300,"Malicious inputs can cause a panic.

A maliciously crafted input can cause a stack overflow and panic. Any user with access to the GraphQL can send such a query.

This issue only occurs when using the graphql.MaxDepth schema option (which is highly recommended in most cases)."
GO-2022-0962,"Applications that use the strvals package in the Helm SDK to parse user supplied input can suffer a Denial of Service when that input causes a panic that cannot be recovered from.

The strvals package contains a parser that turns strings into Go structures. For example, the Helm client has command line flags like --set, --set-string, and others that enable the user to pass in strings that are merged into the values. The strvals package converts these strings into structures Go can work with. Some string inputs can cause array data structures to be created causing an out of memory panic.

The Helm Client will panic with input to --set, --set-string, and other value setting flags that causes an out of memory panic. Helm is not a long running service so the panic will not affect future uses of the Helm client."
GO-2023-1497,"When the scs-library-client is used to pull a container image, with authentication, the HTTP Authorization header sent by the client to the library service may be incorrectly leaked to an S3 backing storage provider."
GO-2022-1114,A ZipSlip vulnerability exists when using the fileutil package to unzip files.
GO-2023-1832,An attacker who controls or compromises a registry can lead a user to verify the wrong artifact.
GO-2020-0007,"Filters containing rules with multiple syscall arguments are improperly constructed, such that all arguments are required to match rather than any of the arguments (AND is used rather than OR). These filters can be bypassed by only specifying a subset of the arguments due to this behavior."
GO-2021-0059,"Due to improper bounds checking, maliciously crafted JSON objects can cause an out-of-bounds panic. If parsing user input, this may be used as a denial of service vector."
GO-2022-0444,"The TUF client is vulnerable to rollback attacks, in which an attacker causes a client to install software older than the software the client previously knew to be available."
GO-2022-1188,An attacker can remotely supply a specially crafted input that causes uncontrolled memory allocation.
GO-2020-0045,"CSRF tokens are generated using math/rand, which is not a cryptographically secure random number generator, allowing an attacker to predict values and bypass CSRF protections with relatively few requests."
GO-2020-0033,"Due to improper sanitization of user input, HTTPEngine.Handle allows for directory traversal, allowing an attacker to read files outside of the target directory that the server has permission to read."
GO-2023-1923,Panic when handling invalid HAProxy PROXY v2 request in github.com/mastercactapus/proxyprotocol
GO-2021-0095,"Due to repeated usage of a XOR key an attacker that can eavesdrop on the TPM 1.2 transport is able to calculate usageAuth for keys created using CreateWrapKey, despite it being encrypted, allowing them to use the created key."
GO-2023-1640,Path traversal when unzipping files in github.com/dablelv/go-huge-util
GO-2022-0588,"The bluemonday HTML sanitizer can leak the contents of a ""style"" element into HTML output, potentially causing XSS vulnerabilities.

The default bluemonday sanitization policies are not vulnerable. Only user-defined policies allowing ""select"", ""style"", and ""option"" elements are affected.

Permitting the ""style"" element in policies is hazardous, because bluemonday does not contain a CSS sanitizer. Newer versions of bluemonday suppress ""style"" and ""script"" elements even when allowed by a policy unless the policy explicitly requests unsafe processing."
GO-2021-0057,"Due to improper bounds checking, maliciously crafted JSON objects can cause an out-of-bounds panic. If parsing user input, this may be used as a denial of service vector."
GO-2023-1578,HashiCorp go-getter is vulnerable to decompression bombs. This can lead to excessive memory consumption and denial-of-service attacks.
GO-2021-0061,"Due to unbounded alias chasing, a maliciously crafted YAML file can cause the system to consume significant system resources. If parsing user input, this may be used as a denial of service vector."
GO-2020-0026,"Due to improper path sanitization, archives containing relative file paths can cause files to be written (or overwritten) outside of the target directory."
GO-2023-1535,"Unmarshalling a Server Hello can panic, which could allow a denial of service."
GO-2020-0004,"If any of the ListenAndServe functions are called with an empty token, token authentication is disabled globally for all listeners.

Also, a minor timing side channel was present allowing attackers with very low latency and able to make many requests to potentially recover the token."
GO-2021-0108,"Due to improper input sanitization, a maliciously constructed filename could cause a file download to use an attacker controlled filename, as well as injecting additional headers into an HTTP response."
GO-2023-1595,"Multiplication of certain unreduced P-256 scalars produce incorrect results.

There are no protocols known at this time that can be attacked due to this."
GO-2021-0102,"Due to improper input validation, a maliciously crafted input can cause a panic, due to incorrect nonce size. If this package is used to decrypt user supplied messages without checking the size of supplied nonces, this may be used as a vector for a denial of service attack."
GO-2022-1040,"Helm does not sanitize all fields read from repository data files. A maliciously crafted data file may contain strings containing arbitrary data. If printed to a terminal, a malicious string could obscure or alter data on the screen."
GO-2023-2098,Unsoundness in variable comparison / non-unique binary decomposition in github.com/consensys/gnark
GO-2021-0060,"Due to the behavior of encoding/xml, a crafted XML document may cause XML Digital Signature validation to be entirely bypassed, causing an unsigned document to appear signed."
GO-2022-0345,The RunUsingChroot function unintentionally propagates environment variables from the current process to the child process.
GO-2021-0052,"Due to improper HTTP header sanitization, a malicious user can spoof their source IP address by setting the X-Forwarded-For header. This may allow a user to bypass IP based restrictions, or obfuscate their true source."
GO-2022-1175,A malicious actor could remotely read local files by submitting to the Alertmanager Set Configuration API maliciously crafted inputs. Only users of the Alertmanager service where `-experimental.alertmanager.enable-api` or `enable_api: true` is configured are affected.
GO-2021-0097,"Due to improper bounds checking, a number of methods can trigger a panic due to attempted out-of-bounds reads. If the package is used to parse user supplied input, this may be used as a vector for a denial of service attack."
GO-2022-1117,"In certain scenarios, a malicious immudb server can provide a falsified proof that will be accepted by the client SDK signing a falsified transaction replacing the genuine one. This situation can not be triggered by a genuine immudb server and requires the client to perform a specific list of verified operations resulting in acceptance of an invalid state value.

This vulnerability only affects immudb client SDKs, the immudb server itself is not affected by this vulnerability."
GO-2023-1681,"A Time-of-check Time-of-use (TOCTOU) flaw appears in this version of podman. This issue may allow a malicious user to replace a normal file in a volume with a symlink while exporting the volume, allowing for access to arbitrary files on the host file system."
GO-2021-0099,"Due to improper path validation, using the github.com/deislabs/oras/pkg/content.FileStore content store may result in directory traversal during archive extraction, allowing a malicious archive to write paths to arbitrary paths that the process can write to."
GO-2023-1547,"An information disclosure vulnerability exists in the `getHostByName` template function.

`getHostByName` is a Helm template function introduced in Helm v3. The function is able to accept a hostname and return an IP address for that hostname. To get the IP address the function performs a DNS lookup. The DNS lookup happens when used with `helm install|upgrade|template` or when the Helm SDK is used to render a chart.

Information passed into the chart can be disclosed to the DNS servers used to lookup the IP address. For example, a malicious chart could inject `getHostByName` into a chart in order to disclose values to a malicious DNS server."
GO-2021-0077,"A user can use a valid client certificate that contains a CommonName that matches a valid RBAC username to authenticate themselves as that user, despite lacking the required credentials. This may allow authentication bypass, but requires a certificate that is issued by a CA trusted by the server."
GO-2020-0036,"Due to unbounded aliasing, a crafted YAML file can cause consumption of significant system resources. If parsing user supplied input, this may be used as a denial of service vector."
GO-2023-1600,"Improper handling of payload with special characters, such as CR/LF and horizontal tab, can lead to execution of arbitrary JavaScript code."
GO-2021-0086,"HTML content in markdown is not sanitized during rendering, possibly allowing XSS if used to render untrusted user input."
GO-2023-1567,"Due to improper request sanitization, a crafted URL can cause the static file handler to redirect to an attacker chosen URL, allowing for open redirect attacks."
GO-2023-1526,"Paranoidhttp before is vulnerable to SSRF because [::] is equivalent to the 127.0.0.1 address, but does not match the filter for private addresses."
GO-2023-2024,A malicious actor can store an arbitrary amount of data in the memory of a remote node by sending the node a message with a signed peer record. Signed peer records from randomly generated peers can be sent by a malicious actor. This memory does not get garbage collected and so the remote node can run out of memory (OOM).
GO-2022-0956,Parsing malicious or large YAML documents can consume excessive amounts of CPU or memory.
GO-2023-1772,Systems that run distribution built after a specific commit running on memory-restricted environments can suffer from denial of service by a crafted malicious /v2/_catalog API endpoint request.
GO-2021-0053,"Due to improper bounds checking, maliciously crafted input to generated Unmarshal methods can cause an out-of-bounds panic. If parsing messages from untrusted parties, this may be used as a denial of service vector."
GO-2021-0089,"Parsing malformed JSON which contain opening brackets, but not closing brackets, leads to an infinite loop. If operating on untrusted user input this can be used as a denial of service vector."
GO-2022-0272,"The Context.UploadFormFiles function is vulnerable to directory traversal attacks, and can be made to write to arbitrary locations outside the destination directory.

This vulnerability only occurs when built with Go versions prior to 1.17. Go 1.17 and later strip directory paths from filenames returned by ""mime/multipart"".Part.FileName, which avoids this issue."
GO-2022-0316,Pretty-printing an AST that contains synthetic nodes can change the logic of some statements by reordering array literals.
GO-2020-0034,"Due to improper path sanitization, archives containing relative file paths can cause files to be written (or overwritten) outside of the target directory."
GO-2022-0411,"Randomly-generated alphanumeric strings contain significantly less entropy than expected.

The RandomAlphaNumeric and CryptoRandomAlphaNumeric functions always return strings containing at least one digit from 0 to 9. This significantly reduces the amount of entropy in short strings generated by these functions."
GO-2022-0528,"Sending a message exactly 2000, 4000, or 6000 characters in length to Discord causes a panic."
GO-2023-1557,"Trying to read malformed HAMT sharded directories can cause panics and virtual memory leaks. If you are reading untrusted user input, an attacker can then trigger a panic.

This is caused by bogus `fanout` parameter in the HAMT directory nodes. A workaround is to not feed untrusted user data to the decoding functions."
GO-2022-1118,"A malicious server can trick a client into treating it as a different server by changing the reported UUID.

immudb client SDKs use the server's UUID to distinguish between different server instance so that the client can connect to different immudb instances and keep the state for multiple servers. The SDK does not validate this UUID and accepts any value reported by the server. A malicious server can therefore change the reported UUID and trick the client into treating it as a different server."
GO-2022-0462,"Client-provided certificates are not correctly validated, and must not be trusted.

DTLS client certificates must be accompanied by proof that the client possesses the private key for the certificate. The Pion DTLS server accepted client certificates unaccompanied by this proof, permitting an attacker to present any certificate and have it accepted as valid."
GO-2022-0384,"The username and password credentials associated with a Helm repository can be passed to another domain referenced by that Helm repository.

If the index.yaml for a Helm repository is hosted on one domain and references a chart archive on a different domain, Helm will provide the credentials for the index.yaml's domain when fetching those archives."
GO-2022-0519,Improper validation of access tokens can permit use of expired tokens.
GO-2020-0032,"Due to improper sanitization of user input, Controller.FileHandler allows for directory traversal, allowing an attacker to read files outside of the target directory that the server has permission to read."
GO-2022-1187,A user controlled string could lead to open redirect.
GO-2022-0391,"The AWS S3 Crypto SDK sends an unencrypted hash of the plaintext alongside the ciphertext as a metadata field. This hash can be used to brute force the plaintext, if the hash is readable to the attacker.

AWS now blocks this metadata field, but older SDK versions still send it."
GO-2022-0629,"Modifying pod status allows host directory traversal.

Kubernetes Secrets Store CSI Driver allows an attacker who can modify a SecretProviderClassPodStatus/Status resource the ability to write content to the host filesystem and sync file contents to Kubernetes Secrets. This includes paths under var/lib/kubelet/pods that contain other Kubernetes Secrets."
GO-2021-0088,"Skip ignores unknown fields, rather than failing. A malicious user can craft small messages with unknown fields which can take significant resources to parse. If a server accepts messages from an untrusted user, it may be used as a denial of service vector."
GO-2022-1148,"go-libp2p is vulnerable to targeted resource exhaustion attacks.

These attacks target libp2p's connection, stream, peer, and memory management. An attacker can cause the allocation of large amounts of memory ultimately leading to the process getting killed by the host's operating system.

While a connection manager tasked with keeping the number of connections within manageable limits has been part of go-libp2p, this component was designed to handle the regular churn of peers, not a targeted resource exhaustion attack.

It's recommend to update to v0.21.0 onwards to get some useful functionality that will help in production environments like better metrics around resource usage, Grafana dashboards around resource usage, allow list support, and default autoscaling limits."
GO-2023-2000,"Large RSA keys can lead to resource exhaustion attacks.

With fix, the size of RSA keys transmitted during handshakes is restricted to <= 8192 bits."
GO-2022-1213,"The Options.Secure value is ignored, and cookies created by Generate never have the secure attribute."
GO-2022-0755,Rancher 2 is vulnerable to a Cross-Site Websocket Hijacking attack that allows an exploiter to gain access to clusters managed by Rancher.
GO-2021-0054,"Due to improper bounds checking, maliciously crafted JSON objects can cause an out-of-bounds panic. If parsing user input, this may be used as a denial of service vector."
GO-2023-2137,"A custom credentials object that does not implement the fmt.Stringer interface may leak sensitive information (e.g., credentials) via logs."
GO-2021-0073,Arbitrary command execution can be triggered by improperly sanitized SSH URLs in LFS configuration files. This can be triggered by cloning a malicious repository.
GO-2021-0084,"Session data is stored using permissive permissions, allowing local users with filesystem access to read arbitrary data."
GO-2021-0081,"The HTTP client used to connect to the container registry authorization service explicitly disables TLS verification, allowing an attacker that is able to MITM the connection to steal credentials."
GO-2023-1549,"Low-privileged users can set the seccomp profile for pods they control to ""unconfined.""

By default, the seccomp profile used in the restricted-v2 Security Context Constraint (SCC) is ""runtime/default,"" allowing users to disable seccomp for pods they can create and modify."
GO-2021-0104,"Due to improper error handling, DTLS connections were not killed when certificate verification failed, causing users who did not check the connection state to continue to use the connection. This could allow allow an attacker which holds the ICE password, but not a valid certificate, to bypass this restriction."
GO-2022-1167,"Applications that use the strvals package in the Helm SDK to parse user supplied input can suffer a Denial of Service when that input causes an error that cannot be recovered from.

The strvals package contains a parser that turns strings into Go structures. For example, the Helm client has command line flags like --set, --set-string, and others that enable the user to pass in strings that are merged into the values. The strvals package converts these strings into structures Go can work with. Some string inputs can cause can cause a stack overflow to be created causing a stack overflow error. Stack overflow errors cannot be recovered from.

The Helm Client will panic with input to --set, --set-string, and other value setting flags that causes a stack overflow. Helm is not a long running service so the error will not affect future uses of the Helm client."
GO-2021-0083,"TLS certificate verification is skipped when connecting to a MQTT server. This allows an attacker who can MITM the connection to read, or forge, messages passed between the client and server."
GO-2022-0952,"Power level parsing does not parse the ""events_default"" key of the m.room.power_levels event, setting the event default power level to zero in all cases. This can cause events to be improperly accepted or rejected in rooms where the event_default power level has been changed."
GO-2021-0412,"The imgcrypt library provides API extensions for containerd to support encrypted container images and implements the ctd-decoder command line tool for use by containerd to decrypt encrypted container images. The imgcrypt function `CheckAuthorization` is supposed to check whether the current used is authorized to access an encrypted image and prevent the user from running an image that another user previously decrypted on the same system. In versions prior to 1.1.4, a failure occurs when an image with a ManifestList is used and the architecture of the local host is not the first one in the ManifestList. Only the first architecture in the list was tested, which may not have its layers available locally since it could not be run on the host architecture. Therefore, the verdict on unavailable layers was that the image could be run anticipating that image run failure would occur later due to the layers not being available. However, this verdict to allow the image to run enabled other architectures in the ManifestList to run an image without providing keys if that image had previously been decrypted. A patch has been applied to imgcrypt 1.1.4. Workarounds may include usage of different namespaces for each remote user."
GO-2020-0043,"Due to improper TLS verification when serving traffic for multiple SNIs, an attacker may bypass TLS client authentication by indicating an SNI during the TLS handshake that is different from the name in the HTTP Host header."
GO-2021-0071,"A race between chown and chmod operations during a container filesystem shift may allow a user who can modify the filesystem to chmod an arbitrary path of their choice, rather than the expected path."
GO-2022-1178,"Errors returned by ghinstallation.Transport can include the JWT used for the failed operation. If the error is exposed to an untrusted party, this JWT could be extracted and used to authenticate further requests."
