id,details
GO-2022-0619,"CORS filters that use an AllowedDomains configuration parameter can match domains outside the specified set, permitting an attacker to avoid the CORS policy.

The AllowedDomains configuration parameter is documented as a list of allowed origin domains, but values in this list are applied as regular expression matches. For example, an allowed domain of ""example.com"" will match the Origin header ""example.com.malicious.domain""."
GO-2022-0435,"A crafted scalar input longer than 32 bytes can cause P256().ScalarMult or P256().ScalarBaseMult to panic. Indirect uses through crypto/ecdsa and crypto/tls are unaffected. amd64, arm64, ppc64le, and s390x are unaffected."
GO-2022-0521,Calling Decoder.Skip when parsing a deeply nested XML document can cause a panic due to stack exhaustion.
GO-2022-0220,"Go on Windows misused certain LoadLibrary functionality, leading to DLL injection."
GO-2022-0166,"The Verify function in crypto/dsa passed certain parameters unchecked to the underlying big integer library, possibly leading to extremely long-running computations, which in turn makes Go programs vulnerable to remote denial of service attacks. Programs using HTTPS client certificates or the Go SSH server libraries are both exposed to this vulnerability."
GO-2021-0227,Clients can cause a panic in SSH servers. An attacker can craft an authentication request message for the gssapi-with-mic method which will cause NewServerConn to panic via a nil pointer dereference if ServerConfig.GSSAPIWithMICConfig is nil.
GO-2022-0192,"The Parse function can panic on some invalid inputs.

For example, the Parse function panics on the input ""<math><template><mo><template>""."
GO-2022-0197,"The Parse function can panic on some invalid inputs.

For example, the Parse function panics on the input ""<svg><template><desc><t><svg></template>""."
GO-2022-0515,Calling any of the Parse functions on Go source code which contains deeply nested types or declarations can cause a panic due to stack exhaustion.
GO-2022-0247,"When invoking functions from WASM modules, built using GOARCH=wasm GOOS=js, passing very large arguments can cause portions of the module to be overwritten with data from the arguments due to a buffer overflow error.

If using wasm_exec.js to execute WASM modules, users will need to replace their copy (as described in https://golang.org/wiki/WebAssembly#getting-started) after rebuilding any modules."
GO-2021-0142,"ReadUvarint and ReadVarint can read an unlimited number of bytes from invalid inputs.

Certain invalid inputs to ReadUvarint or ReadVarint can cause these functions to read an unlimited number of bytes from the ByteReader parameter before returning an error. This can lead to processing more input than expected when the caller is reading directly from a network and depends on ReadUvarint or ReadVarint only consuming a small, bounded number of bytes, even from invalid inputs."
GO-2022-0526,Calling Decoder.Decode on a message which contains deeply nested structures can cause a panic due to stack exhaustion.
GO-2022-0190,"The ""go get"" command is vulnerable to directory traversal when executed with the import path of a malicious Go package which contains curly brace (both '{' and '}' characters).

Specifically, it is only vulnerable in GOPATH mode, but not in module mode (the distinction is documented at https://golang.org/cmd/go/#hdr-Module_aware_go_get). The attacker can cause an arbitrary filesystem write, which can lead to code execution."
GO-2022-0189,"The ""go get"" command is vulnerable to remote code execution when executed with the -u flag and the import path of a malicious Go package, or a package that imports it directly or indirectly.

Specifically, it is only vulnerable in GOPATH mode, but not in module mode (the distinction is documented at https://golang.org/cmd/go/#hdr-Module_aware_go_get).

Using custom domains, it's possible to arrange things so that a Git repository is cloned to a folder named "".git"" by using a vanity import path that ends with ""/.git"". If the Git repository root contains a ""HEAD"" file, a ""config"" file, an ""objects"" directory, a ""refs"" directory, with some work to ensure the proper ordering of operations, ""go get -u"" can be tricked into considering the parent directory as a repository root, and running Git commands on it. That will use the ""config"" file in the original Git repository root for its configuration, and if that config file contains malicious commands, they will execute on the system running ""go get -u"".

Note that forbidding import paths with a .git element might not be sufficient to mitigate this issue, as on certain systems there can be other aliases for VCS state folders."
GO-2022-0535,"A Windows vulnerability allows attackers to spoof valid certificate chains when the system root store is in use.

A workaround is present in Go 1.12.6+ and Go 1.13.7+, but affected users should additionally install the Windows security update to protect their system.

See https://msrc.microsoft.com/update-guide/en-US/vulnerability/CVE-2020-0601 for details on the Windows vulnerability."
GO-2022-0536,"Some HTTP/2 implementations are vulnerable to a reset flood, potentially leading to a denial of service.

Servers that accept direct connections from untrusted clients could be remotely made to allocate an unlimited amount of memory, until the program crashes. The attacker opens a number of streams and sends an invalid request over each stream that should solicit a stream of RST_STREAM frames from the peer. Depending on how the peer queues the RST_STREAM frames, this can consume excess memory, CPU, or both."
GO-2022-0525,"The HTTP/1 client accepted some invalid Transfer-Encoding headers as indicating a ""chunked"" encoding. This could potentially allow for request smuggling, but only if combined with an intermediate server that also improperly failed to reject the header as invalid."
GO-2022-0217,"A DoS vulnerability in the crypto/elliptic implementations of the P-521 and P-384 elliptic curves may let an attacker craft inputs that consume excessive amounts of CPU.

These inputs might be delivered via TLS handshakes, X.509 certificates, JWT tokens, ECDH shares or ECDSA signatures. In some cases, if an ECDH private key is reused more than once, the attack can also lead to key recovery."
GO-2021-0172,"When parsing large multipart/form-data, an attacker can cause a HTTP server to open a large number of file descriptors. This may be used as a denial-of-service vector."
GO-2020-0015,"An attacker could provide a single byte to a UTF16 decoder instantiated with UseBOM or ExpectBOM to trigger an infinite loop if the String function on the Decoder is called, or the Decoder is passed to transform.String. If used to parse user supplied input, this may be used as a denial of service vector."
GO-2023-1992,"The clearsign package accepts some malformed messages, making it possible for an attacker to trick a human user (but not a Go program) into thinking unverified text is part of the message.

With fix, messages with malformed headers in the SIGNED MESSAGE section are rejected."
GO-2021-0240,"NewReader and OpenReader can cause a panic or an unrecoverable fatal error when reading an archive that claims to contain a large number of files, regardless of its actual size."
GO-2022-0213,"Invalid DSA public keys can cause a panic in dsa.Verify. In particular, using crypto/x509.Verify on a crafted X.509 certificate chain can lead to a panic, even if the certificates don't chain to a trusted root. The chain can be delivered via a crypto/tls connection to a client, or to a server that accepts and verifies client certificates. net/http clients can be made to crash by an HTTPS server, while net/http servers that accept client certificates will recover the panic and are unaffected.

Moreover, an application might crash invoking crypto/x509.(*CertificateRequest).CheckSignature on an X.509 certificate request, parsing a golang.org/x/crypto/openpgp Entity, or during a golang.org/x/crypto/otr conversation. Finally, a golang.org/x/crypto/ssh client can panic due to a malformed host key, while a server could panic if either PublicKeyCallback accepts a malformed public key, or if IsUserAuthority accepts a certificate with a malformed public key."
GO-2022-0520,"Client IP adresses may be unintentionally exposed via X-Forwarded-For headers.

When httputil.ReverseProxy.ServeHTTP is called with a Request.Header map containing a nil value for the X-Forwarded-For header, ReverseProxy sets the client IP as the value of the X-Forwarded-For header, contrary to its documentation.

In the more usual case where a Director function sets the X-Forwarded-For header value to nil, ReverseProxy leaves the header unmodified as expected."
GO-2021-0245,ReverseProxy can panic after encountering a problem copying a proxied response body.
GO-2021-0223,"On Windows, if VerifyOptions.Roots is nil, Certificate.Verify does not check the EKU requirements specified in VerifyOptions.KeyUsages. This may allow a certificate to be used for an unintended purpose."
GO-2022-0209,"XORKeyStream generates incorrect and insecure output for very large inputs.

If more than 256 GiB of keystream is generated, or if the counter otherwise grows greater than 32 bits, the amd64 implementation will first generate incorrect output, and then cycle back to previously generated keystream. Repeated keystream bytes can lead to loss of confidentiality in encryption applications, or to predictability in CSPRNG applications.

The issue might affect uses of golang.org/x/crypto/nacl with extremely large messages.

Architectures other than amd64 and uses that generate less than 256 GiB of keystream for a single salsa20.XORKeyStream invocation are unaffected."
GO-2020-0014,"html.Parse does not properly handle ""select"" tags, which can lead to an infinite loop. If parsing user supplied input, this may be used as a denial of service vector."
GO-2022-0524,Calling Reader.Read on an archive containing a large number of concatenated 0-length compressed files can cause a panic due to stack exhaustion.
GO-2021-0224,HTTP servers where the Handler concurrently reads the request body and writes a response can encounter a data race and crash. The httputil.ReverseProxy Handler is affected.
GO-2021-0319,Some big.Int values that are not valid field elements (negative or overflowing) might cause Curve.IsOnCurve to incorrectly return true. Operating on those values may cause a panic or an invalid curve operation. Note that Unmarshal will never return such values.
GO-2022-0236,"A malicious HTTP server or client can cause the net/http client or server to panic.

ReadRequest and ReadResponse can hit an unrecoverable panic when reading a very large header (over 7MB on 64-bit architectures, or over 4MB on 32-bit ones). Transport and Client are vulnerable and the program can be made to crash by a malicious server. Server is not vulnerable by default, but can be if the default max header of 1MB is overridden by setting Server.MaxHeaderBytes to a higher value, in which case the program can be made to crash by a malicious client.

This also affects golang.org/x/net/http2/h2c and HeaderValuesContainsToken in golang.org/x/net/http/httpguts."
GO-2022-0193,"The Parse function can panic on some invalid inputs.

For example, the Parse function panics on the input ""<template><tBody><isindex/action=0>""."
GO-2021-0159,"HTTP headers were not properly parsed, which allows remote attackers to conduct HTTP request smuggling attacks via a request that contains Content-Length and Transfer-Encoding header fields."
GO-2022-0273,"The NewReader and OpenReader functions in archive/zip can cause a panic or an unrecoverable fatal error when reading an archive that claims to contain a large number of files, regardless of its actual size. This is caused by an incomplete fix for CVE-2021-33196."
GO-2021-0317,Rat.SetString had an overflow issue that can lead to uncontrolled memory consumption.
GO-2022-0318,"Incorrect access control is possible in the go command.

The go command can misinterpret branch names that falsely appear to be version tags. This can lead to incorrect access control if an actor is authorized to create branches but not tags."
GO-2021-0235,"The P224() Curve implementation can in rare circumstances generate incorrect outputs, including returning invalid points from ScalarMult."
GO-2022-0531,"An attacker can correlate a resumed TLS session with a previous connection.

Session tickets generated by crypto/tls do not contain a randomly generated ticket_age_add, which allows an attacker that can observe TLS handshakes to correlate successive connections by comparing ticket ages during session resumption."
GO-2022-0212,"net/http (through net/textproto) used to accept and normalize invalid HTTP/1.1 headers with a space before the colon, in violation of RFC 7230.

If a Go server is used behind an uncommon reverse proxy that accepts and forwards but doesn't normalize such invalid headers, the reverse proxy and the server can interpret the headers differently. This can lead to filter bypasses or request smuggling, the latter if requests from separate clients are multiplexed onto the same upstream connection by the proxy. Such invalid headers are now rejected by Go servers, and passed without normalization to Go client applications."
GO-2022-0523,Unmarshaling an XML document into a Go struct which has a nested field that uses the 'any' field tag can panic due to stack exhaustion.
GO-2022-0477,"On Windows, rand.Read will hang indefinitely if passed a buffer larger than 1 << 32 - 1 bytes."
GO-2021-0242,Rat.SetString and Rat.UnmarshalText may cause a panic or an unrecoverable fatal error if passed inputs with very large exponents.
GO-2021-0238,An attacker can craft an input to ParseFragment that causes it to enter an infinite loop and never return.
GO-2022-0532,"On Windows, executing Cmd.Run, Cmd.Start, Cmd.Output, or Cmd.CombinedOutput when Cmd.Path is unset will unintentionally trigger execution of any binaries in the working directory named either ""..com"" or ""..exe""."
GO-2022-0475,"The go command may execute arbitrary code at build time when cgo is in use. This may occur when running go get on a malicious package, or any other command that builds untrusted code.

This can be caused by malicious unquoted symbol name in a linked object file."
GO-2021-0154,"When SessionTicketsDisabled is enabled, crypto/tls allowed man-in-the-middle attackers to spoof clients via unspecified vectors.

If the server enables TLS client authentication using certificates (this is rare) and explicitly sets SessionTicketsDisabled to true in the tls.Config, then a malicious client can falsely assert ownership of any client certificate it wishes."
GO-2021-0160,"Int.Exp Montgomery mishandled carry propagation and produced an incorrect output, which makes it easier for attackers to obtain private RSA keys via unspecified vectors.

This issue can affect RSA computations in crypto/rsa, which is used by crypto/tls. TLS servers on 32-bit systems could plausibly leak their RSA private key due to this issue. Other protocol implementations that create many RSA signatures could also be impacted in the same way.

Specifically, incorrect results in one part of the RSA Chinese Remainder computation can cause the result to be incorrect in such a way that it leaks one of the primes. While RSA blinding should prevent an attacker from crafting specific inputs that trigger the bug, on 32-bit systems the bug can be expected to occur at random around one in 2^26 times. Thus collecting around 64 million signatures (of known data) from an affected server should be enough to extract the private key used.

Note that on 64-bit systems, the frequency of the bug is so low (less than one in 2^50) that it would be very difficult to exploit."
GO-2021-0263,"Calling File.ImportedSymbols on a loaded file which contains an invalid dynamic symbol table command can cause a panic, in particular if the encoded number of undefined symbols is larger than the number of symbols in the symbol table."
GO-2021-0226,"When a Handler does not explicitly set the Content-Type header, the the package would default to text/html, which could cause a Cross-Site Scripting vulnerability if an attacker can control any part of the contents of a response.

The Content-Type header is now set based on the contents of the first Write using http.DetectContentType, which is consistent with the behavior of the net/http package.

Although this protects some applications that validate the contents of uploaded files, not setting the Content-Type header explicitly on any attacker-controlled file is unsafe and should be avoided."
GO-2021-0356,"Attackers can cause a crash in SSH servers when the server has been configured by passing a Signer to ServerConfig.AddHostKey such that
1) the Signer passed to AddHostKey does not implement AlgorithmSigner, and
2) the Signer passed to AddHostKey returns a key of type ssh-rsa from its PublicKey method.

Servers that only use Signer implementations provided by the ssh package are unaffected."
GO-2021-0234,"The Decode, DecodeElement, and Skip methods of an xml.Decoder provided by xml.NewTokenDecoder may enter an infinite loop when operating on a custom xml.TokenReader which returns an EOF in the middle of an open XML element."
GO-2022-0434,"Verifying certificate chains containing certificates which are not compliant with RFC 5280 causes Certificate.Verify to panic on macOS.

These chains can be delivered through TLS and can cause a crypto/tls or net/http client to crash."
GO-2020-0012,"An attacker can craft an ssh-ed25519 or sk-ssh-ed25519@openssh.com public key, such that the library will panic when trying to verify a signature with it. If verifying signatures using user supplied public keys, this may be used as a denial of service vector."
GO-2022-0191,"The crypto/x509 package does not limit the amount of work performed for each chain verification, which might allow attackers to craft pathological inputs leading to a CPU denial of service. Go TLS servers accepting client certificates and TLS clients verifying certificates are affected."
GO-2022-0537,"Decoding big.Float and big.Rat types can panic if the encoded message is too short, potentially allowing a denial of service."
GO-2021-0067,"Using Reader.Open on an archive containing a file with a path prefixed by ""../"" will cause a panic due to a stack overflow. If parsing user supplied archives, this may be used as a denial of service vector."
GO-2021-0347,"On 64-bit platforms, an extremely deeply nested expression can cause regexp.Compile to cause goroutine stack exhaustion, forcing the program to exit. Note this applies to very large expressions, on the order of 2MB."
GO-2022-0289,"When a Go program running on a Unix system is out of file descriptors and calls syscall.ForkExec (including indirectly by using the os/exec package), syscall.ForkExec can close file descriptor 0 as it fails. If this happens (or can be provoked) repeatedly, it can result in misdirected I/O such as writing network traffic intended for one connection to a different connection, or content intended for one file to a different one.

For users who cannot immediately update to the new release, the bug can be mitigated by raising the per-process file descriptor limit."
GO-2022-0171,"On Darwin, user's trust preferences for root certificates were not honored. If the user had a root certificate loaded in their Keychain that was explicitly not trusted, a Go program would still verify a connection using that root certificate."
GO-2021-0069,A number of math/big.Int methods can panic when provided large inputs due to a flawed division method.
GO-2022-0533,"On Windows, the filepath.Clean function can convert certain invalid paths to valid, absolute paths, potentially allowing a directory traversal attack.

For example, Clean(`.\c:`) returns `c:`."
GO-2022-0761,"An input validation flaw in the CGI components allows the HTTP_PROXY environment variable to be set by the incoming Proxy header, which changes where Go by default proxies all outbound HTTP requests.

This environment variable is also used to set the outgoing proxy, enabling an attacker to insert a proxy into outgoing requests of a CGI program.

Read more about ""httpoxy"" here: https://httpoxy.org."
GO-2021-0163,Untrusted search path vulnerability on Windows related to LoadLibrary allows local users to gain privileges via a malicious DLL in the current working directory.
GO-2021-0243,crypto/tls clients can panic when provided a certificate of the wrong type for the negotiated parameters. net/http clients performing HTTPS requests are also affected.
GO-2021-0113,"Due to improper index calculation, an incorrectly formatted language tag can cause Parse to panic via an out of bounds read. If Parse is used to process untrusted user inputs, this may be used as a vector for a denial of service attack."
GO-2021-0241,"ReverseProxy can be made to forward certain hop-by-hop headers, including Connection. If the target of the ReverseProxy is itself a reverse proxy, this lets an attacker drop arbitrary headers, including those set by the ReverseProxy.Director."
GO-2021-0239,"The LookupCNAME, LookupSRV, LookupMX, LookupNS, and LookupAddr functions and their respective methods on the Resolver type may return arbitrary values retrieved from DNS which do not follow the established RFC 1035 rules for domain names. If these names are used without further sanitization, for instance unsafely included in HTML, they may allow for injection of unexpected content. Note that LookupTXT may still return arbitrary values that could require sanitization before further use."
GO-2020-0013,By default host key verification is disabled which allows for man-in-the-middle attacks against SSH clients if ClientConfig.HostKeyCallback is not set.
GO-2021-0264,"Previously, opening a zip with (*Reader).Open could result in a panic if the zip contained a file whose name was exclusively made up of slash characters or "".."" path elements.

Open could also panic if passed the empty string directly as an argument.

Now, any files in the zip whose name could not be made valid for fs.FS.Open will be skipped, and no longer added to the fs.FS file list, although they are still accessible through (*Reader).File.

Note that it was already the case that a file could be accessible from (*Reader).Open with a name different from the one in (*Reader).File, as the former is the cleaned name, while the latter is the original one.

Finally, the actual panic site was made robust as a defense-in-depth measure."
GO-2021-0078,"The HTML parser does not properly handle ""in frameset"" insertion mode, and can be made to panic when operating on malformed HTML that contains <template> tags. If operating on user input, this may be a vector for a denial of service attack."
GO-2022-0211,"The url.Parse function accepts URLs with malformed hosts, such that the Host field can have arbitrary suffixes that appear in neither Hostname() nor Port(), allowing authorization bypasses in certain applications."
